user,name,maybe_name
aaelony,NA,
aaronwolen,Aaron Wolen, (Aaron Wolen)
ablejec,Andrej Blejec, (Andrej Blejec)
adamcduncan,Adam Duncan, (Adam Duncan)
adessy,NA,
adrtod,Adrien Todeschini, (Adrien Todeschini)
aghaynes,Alan Haynes, (Alan Haynes)
agrueneberg,Alexander Grueneberg, (Alexander Grueneberg)
alejandrohagan,Alejandro Hagan, (Alejandro Hagan)
alesantuz,Ale Santuz, (Ale Santuz)
alexandrehsd,Alexandre Henrique, (Alexandre Henrique)
alexholcombe,Alex O. Holcombe, (Alex O. Holcombe)
alexpghayes,alex hayes, (alex hayes)
alforj,Justin Alford, (Justin Alford)
almartin82,Andrew Martin, (Andrew Martin)
aluxh,Alex Ho, (Alex Ho)
AmelZulji,NA,
andreaphsz,Andrea Cantieni, (Andrea Cantieni)
andrewdolman,Andrew Dolman, (Andrew Dolman)
andrewpbray,Andrew Bray, (Andrew Bray)
AndrewsOR,John Andrews, (John Andrews)
andycraig,Andrew Craig, (Andrew Craig)
angela-li,Angela Li, (Angela Li)
anjalisilva,Anjali Silva, (Anjali Silva)
apomatix,Brad Friedman, (Brad Friedman)
apreshill,Alison Presmanes Hill, (Alison Presmanes Hill)
arashHaratian,Arash, (Arash)
arilamstein,Ari Lamstein, (Ari Lamstein)
arneschillert,Arne Schillert, (Arne Schillert)
arni-magnusson,Arni Magnusson, (Arni Magnusson)
asadow,Adam Sadowski, (Adam Sadowski)
ateucher,Andy Teucher, (Andy Teucher)
avisser,Andy Visser, (Andy Visser)
ayormark,Adam Yormark, (Adam Yormark)
azzaea,Azza Ahmed, (Azza Ahmed)
batpigandme,Mara Averick, (Mara Averick)
bclipp,Brian L, (Brian L)
beevabeeva,NA,
behrman,Bill Behrman, (Bill Behrman)
benmarwick,Ben Marwick, (Ben Marwick)
BernhardKonrad,Bernhard Konrad, (Bernhard Konrad)
bgreenwell,Brandon Greenwell, (Brandon Greenwell)
Bisaloo,Hugo Gruson, (Hugo Gruson)
bklamer,Brett Klamer, (Brett Klamer)
bm5tev3,NA,
bms63,Ben Straub, (Ben Straub)
bpbond,Ben Bond-Lamberty, (Ben Bond-Lamberty)
bquast,Bastiaan Quast, (Bastiaan Quast)
Br-Johnson,Brett Johnson, (Brett Johnson)
brews,Brewster Malevich, (Brewster Malevich)
brianrice2,Brian Rice, (Brian Rice)
brry,Berry Boessenkool, (Berry Boessenkool)
btruel,NA,
calligross,Calli, (Calli)
carldotac,Carl Lieberman, (Carl Lieberman)
carloscinelli,Carlos Cinelli, (Carlos Cinelli)
CDCookJr,NA,
cderv,Christophe Dervieux, (Christophe Dervieux)
chambm,Matt Chambers, (Matt Chambers)
charliejhadley,Charlie Joey Hadley, (Charlie Joey Hadley)
chezou,Aki Ariga, (Aki Ariga)
chsafouane,Safouane Chergui, (Safouane Chergui)
clente,Caio Lente, (Caio Lente)
cmarmstrong,NA,
cooknl,CAPN, (CAPN)
CorradoLanera,Corrado Lanera, (Corrado Lanera)
craigcitro,Craig Citro, (Craig Citro)
crtahlin,Crt Ahlin, (Crt Ahlin)
daattali,Dean Attali, (Dean Attali)
danhalligan,Dan Halligan, (Dan Halligan)
daroczig,Gergely Daróczi, (Gergely Daróczi)
datarttu,Arttu Kosonen, (Arttu Kosonen)
davidkane9,David Kane, (David Kane)
DavisVaughan,Davis Vaughan, (Davis Vaughan)
deanbodenham,NA,
dfalbel,Daniel Falbel, (Daniel Falbel)
dgrtwo,David Robinson, (David Robinson)
dholstius,David Holstius, (David Holstius)
DickStartz,NA,
dkgaraujo,Douglas K. G. Araujo, (Douglas K. G. Araujo)
dlukes,David Lukes, (David Lukes)
DOH-PXC5303,Philip Crain, (Philip Crain)
dongzhuoer,Zhuoer Dong, (Zhuoer Dong)
DougManuel,Doug Manuel, (Doug Manuel)
dpprdan,Daniel Possenriede, (Daniel Possenriede)
dracodoc,dracodoc, (dracodoc)
drag05,Dragos Bandur, (Dragos Bandur)
drvinceknight,Vince Knight, (Vince Knight)
dryzliang,NA,
dyavorsky,Dan Yavorsky, (Dan Yavorsky)
e-pet,NA,
earino,E. Ariño de la Rubia, (E. Ariño de la Rubia)
echelleburns,NA,
eeholmes,Eli Holmes, (Eli Holmes)
eipi10,Joel Schwartz, (Joel Schwartz)
ekbrown,Earl Brown, (Earl Brown)
EllaKaye,Ella Kaye, (Ella Kaye)
EmilHvitfeldt,Emil Hvitfeldt, (Emil Hvitfeldt)
eogoodwin,NA,
erictleung,Eric Leung, (Eric Leung)
erikerhardt,Erik Erhardt, (Erik Erhardt)
espinielli,Enrico Spinielli, (Enrico Spinielli)
ewan,Ewan Dunbar, (Ewan Dunbar)
fbertran,Frederic Bertrand, (Frederic Bertrand)
federicomarini,Federico Marini, (Federico Marini)
fenguoerbian,Chao Cheng, (Chao Cheng)
fkohrt,Florian Kohrt, (Florian Kohrt)
florisvdh,Floris Vanderhaeghe, (Floris Vanderhaeghe)
floswald,Florian Oswald, (Florian Oswald)
franrodalg,Francisco Rodríguez-Algarra, (Francisco Rodríguez-Algarra)
franticspider,Simon Hickinbotham, (Simon Hickinbotham)
frycast,Daniel Vidali Fryer, (Daniel Vidali Fryer)
fsavje,Fredrik Sävje, (Fredrik Sävje)
gajusmiknaitis,NA,
gcpoole,Geoffrey Poole, (Geoffrey Poole)
geanders,Brooke Anderson, (Brooke Anderson)
georoen,Jee Roen, (Jee Roen)
GerardTromp,Gerard Tromp, (Gerard Tromp)
GillesSanMartin,Gilles San Martin, (Gilles San Martin)
gmaubach,Georg Maubach, (Georg Maubach)
gonzalezgouveia,Rafael Gonzalez Gouveia, (Rafael Gonzalez Gouveia)
gregmacfarlane,Greg Macfarlane, (Greg Macfarlane)
gregrs-uk,Greg, (Greg)
grst,Gregor Sturm, (Gregor Sturm)
gsrohde,Scott Rohde, (Scott Rohde)
guru809,NA,
gustavdelius,Gustav W Delius, (Gustav W Delius)
haibin,Liu Haibin, (Liu Haibin)
hanneoberman,Hanne Oberman, (Hanne Oberman)
harrismcgehee,Harris McGehee, (Harris McGehee)
havenl,Haven Liu, (Haven Liu)
hcyvan,程一航, (程一航)
hdraisma,Harmen, (Harmen)
hedderik,Hedderik van Rijn, (Hedderik van Rijn)
heists,(ꐦ°᷄д°)ა, ((ꐦ°᷄д°)ა)
helske,Jouni Helske, (Jouni Helske)
henningte,Henning Teickner, (Henning Teickner)
HenrikBengtsson,Henrik Bengtsson, (Henrik Bengtsson)
heogden,Helen Ogden, (Helen Ogden)
hfrick,Hannah Frick, (Hannah Frick)
Holzhauer,Sascha Holzhauer, (Sascha Holzhauer)
howardbaek,Howard Baek, (Howard Baek)
howbuildingsfail,How Buildings Fail, (How Buildings Fail)
hq9000,Sergey Grechin, (Sergey Grechin)
hrbrmstr,boB Rudis, (boB Rudis)
iangow,Ian Gow, (Ian Gow)
iargent,NA,
idmn,Iaroslav Domin, (Iaroslav Domin)
ijlyttle,Ian Lyttle, (Ian Lyttle)
imchoyoung,Choyoung Im, (Choyoung Im)
InfiniteCuriosity,Russ Conte, (Russ Conte)
ionut-stefanb,Ionut Stefan-Birdea, (Ionut Stefan-Birdea)
Ironholds,Os Keyes, (Os Keyes)
ismayc,Chester Ismay, (Chester Ismay)
isomorphisms,i, (i)
jackwasey,Jack Wasey, (Jack Wasey)
jacobbien,Jacob Bien, (Jacob Bien)
jadeynryan,Jadey Ryan, (Jadey Ryan)
jameelalsalam,Jameel Alsalam, (Jameel Alsalam)
jameslairdsmith,James Laird-Smith, (James Laird-Smith)
janzzon,Stefan Jansson, (Stefan Jansson)
JayCeBB,NA,
jcainey,Joe Cainey, (Joe Cainey)
jdblischak,John Blischak, (John Blischak)
jedwards24,James Edwards, (James Edwards)
jemus42,Lukas Burk, (Lukas Burk)
jenniferthompson,Jennifer Thompson, (Jennifer Thompson)
jeremycg,Jeremy Gray, (Jeremy Gray)
jgarthur,Joey Arthur, (Joey Arthur)
jimhester,Jim Hester, (Jim Hester)
jimr1603,James Riley, (James Riley)
jjesusfilho,José de Jesus Filho, (José de Jesus Filho)
jkeirstead,James Keirstead, (James Keirstead)
jmarca,James Marca, (James Marca)
jmarshallnz,Jonathan Marshall, (Jonathan Marshall)
joethorley,Joe Thorley, (Joe Thorley)
johnbaums,John, (John)
jolars,Johan Larsson, (Johan Larsson)
jonthegeek,Jon Harmon, (Jon Harmon)
jowalski,John Kowalski, (John Kowalski)
jpinelo,Joao Pinelo Silva, (Joao Pinelo Silva)
jrdnbradford,Jordan, (Jordan)
jthomasmock,Tom Mock, (Tom Mock)
julian-urbano,Julián Urbano, (Julián Urbano)
jwpestrak,NA,
jzadra,Jonathan Zadra, (Jonathan Zadra)
jzhaoo,Joanna Zhao, (Joanna Zhao)
kaetschap,Sonja, (Sonja)
karthik,Karthik Ram, (Karthik Ram)
KasperThystrup,Kasper Thystrup Karstensen, (Kasper Thystrup Karstensen)
KatherineCox,NA,
katrinleinweber,Katrin Leinweber, (Katrin Leinweber)
kbroman,Karl Broman, (Karl Broman)
kekecib,Ibrahim Kekec, (Ibrahim Kekec)
KellenBrosnahan,NA,
kendonB,Kendon Bell, (Kendon Bell)
kevinushey,Kevin Ushey, (Kevin Ushey)
kikapp,Kristopher Kapphahn, (Kristopher Kapphahn)
KirkDSL,NA,
KJByron,Karen J. Byron, (Karen J. Byron)
klmr,Konrad Rudolph, (Konrad Rudolph)
KoderKow,Kyle Harris, (Kyle Harris)
kokbent,Ben Toh, (Ben Toh)
kongdd,Dongdong Kong, (Dongdong Kong)
krlmlr,Kirill Müller, (Kirill Müller)
kwenzig,Knut Wenzig, (Knut Wenzig)
kwstat,Kevin Wright, (Kevin Wright)
kylelundstedt,Kyle G. Lundstedt, (Kyle G. Lundstedt)
lancelote,Pavel Karateev, (Pavel Karateev)
lbergelson,Louis Bergelson, (Louis Bergelson)
LechMadeyski,Lech Madeyski, (Lech Madeyski)
Lenostatos,Leon, (Leon)
lindbrook,NA,
lionel-,Lionel Henry, (Lionel Henry)
LluisRamon,Lluís Ramon, (Lluís Ramon)
lorenzwalthert,Lorenz Walthert, (Lorenz Walthert)
lwjohnst86,Luke W Johnston, (Luke W Johnston)
maelle,Maëlle Salmon, (Maëlle Salmon)
maiermarco,NA,
maislind,David M, (David M)
majr-red,Matthew Roberts, (Matthew Roberts)
malcolmbarrett,Malcolm Barrett, (Malcolm Barrett)
malexan,Alexander Matrunich, (Alexander Matrunich)
manuelreif,Manuel Reif, (Manuel Reif)
MarceloRTonon,Marcelo Tonon, (Marcelo Tonon)
mariacuellar,Maria Cuellar, (Maria Cuellar)
markdly,Mark Dulhunty, (Mark Dulhunty)
Marlin-Na,Marlin, (Marlin)
martin-mfg,NA,
matanhakim,Matan Hakim, (Matan Hakim)
matdoering,NA,
matinang,Matina Angelopoulou, (Matina Angelopoulou)
mattflor,Matthias Flor, (Matthias Flor)
maurolepore,Mauro Lepore, (Mauro Lepore)
maxheld83,Max Held, (Max Held)
mayankvanani,Mayank Vanani, (Mayank Vanani)
mbjones,Matt Jones, (Matt Jones)
mccarthy-m-g,Michael McCarthy, (Michael McCarthy)
mdequeljoe,Matthew de Queljoe, (Matthew de Queljoe)
mdsumner,Michael Sumner, (Michael Sumner)
michaelboerman,Michael Boerman, (Michael Boerman)
MichaelChirico,Michael Chirico, (Michael Chirico)
michaelmikebuckley,Michael Buckley, (Michael Buckley)
michaelweylandt,Michael Weylandt, (Michael Weylandt)
miguelmorin,NA,
MikeJohnPage,NA,
mikelnrd,Michael Leonard, (Michael Leonard)
mikelove,Mike Love, (Mike Love)
mikemc,Michael McLaren, (Michael McLaren)
MilesMcBain,Miles McBain, (Miles McBain)
mjkanji,Muhammad Jarir Kanji, (Muhammad Jarir Kanji)
mkuehn10,Michael Kuehn, (Michael Kuehn)
mllg,Michel Lang, (Michel Lang)
mohamed-180,Mohamed El-Desokey, (Mohamed El-Desokey)
moodymudskipper,Antoine Fabri, (Antoine Fabri)
Moohan,James McMahon, (James McMahon)
MrAE,Jesse Leigh Patsolic, (Jesse Leigh Patsolic)
mrcaseb,NA,
ms609,Martin R. Smith, (Martin R. Smith)
mskyttner,Markus Skyttner, (Markus Skyttner)
MWilson92,Matthew Wilson, (Matthew Wilson)
myoung3,NA,
nachti,Gerhard Nachtmann, (Gerhard Nachtmann)
nanxstats,Nan Xiao, (Nan Xiao)
nareal,Nelson Areal, (Nelson Areal)
nattalides,NA,
ncarchedi,Nick Carchedi, (Nick Carchedi)
ndphillips,Nathaniel Phillips, (Nathaniel Phillips)
nick-youngblut,Nick Youngblut, (Nick Youngblut)
njtierney,Nicholas Tierney, (Nicholas Tierney)
nsheff,Nathan Sheffield, (Nathan Sheffield)
osorensen,Øystein Sørensen, (Øystein Sørensen)
PabRod,Pablo Rodríguez-Sánchez, (Pablo Rodríguez-Sánchez)
paternogbc,Gustavo Brant Paterno, (Gustavo Brant Paterno)
paulrougieux,Paul Rougieux, (Paul Rougieux)
pdwaggoner,Philip Waggoner, (Philip Waggoner)
pearsonca,Carl A. B. Pearson, (Carl A. B. Pearson)
perryjer1,Jeremiah, (Jeremiah)
petermeissner,Peter Meissner, (Peter Meissner)
petersonR,Ryan Peterson, (Ryan Peterson)
petzi53,Peter Baumgartner, (Peter Baumgartner)
PhilipPallmann,Philip Pallmann, (Philip Pallmann)
philliplab,Phillip Labuschagne, (Phillip Labuschagne)
phonixor,Gerrit-Jan Schutten, (Gerrit-Jan Schutten)
pkimes,Patrick Kimes, (Patrick Kimes)
pnovoa,Pavel Novoa, (Pavel Novoa)
ppanko,Pavel Panko, (Pavel Panko)
pritesh-shrivastava,Pritesh Shrivastava, (Pritesh Shrivastava)
PrzeChoj,PrzeChoj, (PrzeChoj)
PursuitOfDataScience,Y. Yu, (Y. Yu)
pwaeckerle,NA,
raerickson,Richard Erickson, (Richard Erickson)
ramiromagno,Ramiro Magno, (Ramiro Magno)
ras44,NA,
rbirkelbach,Robert Birkelbach, (Robert Birkelbach)
rcorty,Robert W. Corty, (Robert W. Corty)
rdiaz02,Ramon Diaz-Uriarte, (Ramon Diaz-Uriarte)
realAkhmed,Akhmed Umyarov, (Akhmed Umyarov)
reikookamoto,Reiko Okamoto, (Reiko Okamoto)
renkun-ken,Kun Ren, (Kun Ren)
retowyss,Reto Wyss, (Reto Wyss)
revodavid,David Smith, (David Smith)
rgknight,Ryan Knight, (Ryan Knight)
rhgof,Richard, (Richard)
rmar073,NA,
rmflight,Robert M Flight, (Robert M Flight)
rmsharp,R. Mark Sharp, (R. Mark Sharp)
rnuske,Robert Nuske, (Robert Nuske)
robertzk,Robert Krzyzanowski, (Robert Krzyzanowski)
Robinlovelace,Robin Lovelace, (Robin Lovelace)
robiRagan,Robi Ragan, (Robi Ragan)
Robsteranium,Robin Gower, (Robin Gower)
romanzenka,Roman Zenka, (Roman Zenka)
royfrancis,Roy Francis, (Roy Francis)
rpruim,Randall Pruim, (Randall Pruim)
rrunner,NA,
rsangole,Rahul, (Rahul)
ryanatanner,Ryan, (Ryan)
salim-b,Salim B, (Salim B)
SamEdwardes,Sam Edwardes, (Sam Edwardes)
SangdonLim,Sangdon Lim, (Sangdon Lim)
sathishsrinivasank,Sathish, (Sathish)
sbgraves237,NA,
schifferl,Lucas Schiffer, (Lucas Schiffer)
scw,Shaun Walbridge, (Shaun Walbridge)
sdarodrigues,Sabrina Rodrigues, (Sabrina Rodrigues)
sebffischer,Sebastian Fischer, (Sebastian Fischer)
serghiou,Stylianos Serghiou, (Stylianos Serghiou)
setoyama60jp,NA,
sfirke,Sam Firke, (Sam Firke)
shannonpileggi,Shannon Pileggi, (Shannon Pileggi)
Shelmith-Kariuki,Shel, (Shel)
SheridanLGrant,Sheridan Grant, (Sheridan Grant)
shntnu,Shantanu Singh, (Shantanu Singh)
sibusiso16,S'busiso Mkhondwane, (S'busiso Mkhondwane)
simdadim,Simen Buodd, (Simen Buodd)
SimonPBiggs,SPB, (SPB)
simonthelwall,Simon Thelwall, (Simon Thelwall)
SimonYansenZhao,Simon He Zhao, (Simon He Zhao)
singmann,Henrik Singmann, (Henrik Singmann)
Skenvy,Nathan Levett, (Nathan Levett)
Smudgerville,Richard M. Smith, (Richard M. Smith)
sn248,Satyaprakash Nayak, (Satyaprakash Nayak)
sowla,Praer (Suthira) Owlarn, (Praer (Suthira) Owlarn)
srushe,Stephen Rushe, (Stephen Rushe)
statnmap,Sébastien Rochette, (Sébastien Rochette)
steenharsted,Steen Harsted, (Steen Harsted)
stefaneng,Stefan Eng, (Stefan Eng)
stefanherzog,Stefan Herzog, (Stefan Herzog)
stephen-frank,Stephen Frank, (Stephen Frank)
stephenll,Stephen Lienhard, (Stephen Lienhard)
stephenturner,Stephen Turner, (Stephen Turner)
stevenprimeaux,Steven Primeaux, (Steven Primeaux)
stevensbr,NA,
stewid,Stefan Widgren, (Stefan Widgren)
sunbeomk,Sunbeom Kwon, (Sunbeom Kwon)
superdesolator,Po Su, (Po Su)
syclik,Daniel Lee, (Daniel Lee)
symbolrush,Adrian Stämpfli-Schmid, (Adrian Stämpfli-Schmid)
taekyunk,Taekyun Kim, (Taekyun Kim)
talgalili,Tal Galili, (Tal Galili)
tanho63,Tan Ho, (Tan Ho)
tbrugz,Telmo Brugnara, (Telmo Brugnara)
thisisnic,Nic Crane, (Nic Crane)
TimHesterberg,Tim Hesterberg, (Tim Hesterberg)
titaniumtroop,Nathan, (Nathan)
tjebo,NA,
tklebel,Thomas Klebel, (Thomas Klebel)
tmstauss,Tanner Stauss, (Tanner Stauss)
tonybreyal,Tony Breyal, (Tony Breyal)
tonyfischetti,Tony Fischetti, (Tony Fischetti)
TonyLadson,Tony Ladson, (Tony Ladson)
trickytank,Rick Tankard, (Rick Tankard)
TroyVan,NA,
uribo,Shinya Uryu, (Shinya Uryu)
urmils,NA,
valeonte,NA,
vgonzenbach,Virgilio Gonzenbach, (Virgilio Gonzenbach)
vladpetyuk,Vlad Petyuk, (Vlad Petyuk)
vnijs,Vincent Nijs, (Vincent Nijs)
vspinu,Vitalie Spinu, (Vitalie Spinu)
wcarlsen,Willi Carlsen, (Willi Carlsen)
wch,Winston Chang, (Winston Chang)
wenjie2wang,Wenjie Wang, (Wenjie Wang)
werkstattcodes,NA,
wiaidp,NA,
wibeasley,Will Beasley, (Will Beasley)
wilkinson,Sean Wilkinson, (Sean Wilkinson)
williamlief,Lief Esbenshade, (Lief Esbenshade)
winterschlaefer,Christof Winter, (Christof Winter)
wlamnz,William Lam, (William Lam)
wrathematics,Drew Schmidt, (Drew Schmidt)
XiangyunHuang,Xiangyun Huang, (Xiangyun Huang)
xiaochi-liu,Xiaochi, (Xiaochi)
XiaoqiLu,Xiaoqi Lu, (Xiaoqi Lu)
xiaosongz,Xiaosong Zhang, (Xiaosong Zhang)
yihui,Yihui Xie, (Yihui Xie)
ynsec37,NA,
yonicd,NA,
ysdgroot,NA,
yui-knk,Yuichiro Kaneko, (Yuichiro Kaneko)
Zedseayou,Calum You, (Calum You)
zeehio,Sergio Oller, (Sergio Oller)
zekiakyol,Zeki Akyol, (Zeki Akyol)
zenggyu,Guangyu Zeng, (Guangyu Zeng)
zhaoy,NA,
zhilongjia,Zhilong, (Zhilong)
zhixunwang,NA,
zkamvar,Zhian N. Kamvar, (Zhian N. Kamvar)
zouter,Wouter Saelens, (Wouter Saelens)
